uid,body,title,url,newspaper_uid,host,n_tokens_title,n_tokens_body
d1e5e49ad60ba88a8d540dc9a2433210,"  Google da un paso adelante para lanzar por su cuenta su propio servicio de mensajería instantánea que haga frente a otras aplicaciones como WhatsApp y Telegram. Se trata de los Rich Communications Services (servicios de comunicaciones enriquecidas o RCS, por sus siglas en inglés). En un principio la compañía iba a lanzar este servicio como fruto de un acuerdo con los operadores de telecomunicaciones y fabricantes de smartphones. Pero ante el lento despliegue del servicio, Google ha decidido dar la espalda a las operadoras y ofrecer por su cuenta soporte RCS a todos los móviles Android a través de la aplicación Mensajes, según informa el medio especializado en tecnología The Verge.  Cuando la tecnología RCS esté desplegada, no será necesario vincular el número de teléfono con ningún servicio externo para poder chatear con los diferentes contactos. El despliegue estará listo para los usuarios de Reino Unido y Francia a finales de junio independientemente de si sus operadoras ofrecen soporte para esta tecnología. No obstante, aquellas operadoras que así lo deseen podrán implementar esta tecnología entre su oferta de servicios. Los RCS se extenderán al resto de países de forma progresiva, según ha explicado la compañía al mismo medio. Este periódico se ha puesto en contacto con Google, que por el momento no ha hecho declaraciones al respecto.  Los RCS se presentan como una evolución muy mejorada de los extintos SMS. Los usuarios ya casi no los usan y, en su lugar, suelen optar por aplicaciones que les ofrecen más posibilidades como WhatsApp o Telegram. Con los Rich Communications Services, Google pretende ofrecer en la aplicación de Mensajes del móvil las mismas funciones que las apps de mensajería instantánea. Por ejemplo, chats de grupo, estados, confirmación de lectura de los mensajes, ubicaciones, emojis o notas de voz. De esta forma, el usuario podría aprovecharse de todas estas opciones sin necesidad de utilizar una aplicación de terceros.  Sin cifrar                   El director general de Google, Sundar Pichai, el pasado jueves. Matt Barnard AP            El mayor problema del nuevo servicio de Google es que los mensajes aún no están cifrados de extremo a extremo. Aplicaciones como iMessage, WhatsApp y Signal están protegidas de esa manera e incluso Facebook ha afirmado que hará que todas sus aplicaciones estén encriptadas de forma predeterminada. No obstante, la compañía de Mountain View reconoce la necesidad de garantizar la privacidad de los usuarios en su nuevo servicio y ya trabaja en ello, según ha asegurado a The Verge la directora de gestión de producto a cargo de este servicio, Sanaz Ahari: “Creemos que la comunicación, y especialmente la mensajería, es muy personal y que los usuarios tienen derecho a la privacidad de sus comunicaciones. Estamos totalmente comprometidos para encontrar una solución para nuestros usuarios”.  Aunque los RCS no están por el momento cifrados de extremo a extremo, la compañía ha asegurado que eliminará los mensajes de sus servidores tan pronto como sean entregados al destinatario. “Si lo guardamos, es solo para entregarlo cuando esa persona se conecte”, ha explicado al mismo medio Drew Rowny, líder de producto de Mensajes de Google. No ocurrirá lo mismo con el envío de archivos como GIFs, fotos o vídeos, que sí se conservarán durante un breve periodo de tiempo en los servidores aunque sin nada que identifique a los usuarios para garantizar que todos los destinatarios puedan descargar el archivo.  Una diferencia entre los RCS con respecto a otros servicios de mensajería instantánea o aplicaciones como iMessage es que no existe una base de datos de quién los tiene y quién no. En este caso, cuando el usuario envíe un mensaje, el sistema consultará si el usuario receptor cuenta con soporte para la tecnología RCS. Si es así, se habilitarán todas las funciones disponibles con el nuevo servicio. En el caso contrario, se recurrirá a los SMS.  ",Google lanzará su propia mensajería para competir con WhatsApp y Telegram,https://elpais.com/tecnologia/2019/06/18/actualidad/1560876564_858578.html,elpais,elpais.com,5,277
4c59d637f8ac2903961578f4eb13132e,"  Hace más de 50 años que ESIC Business & Marketing School es una referencia en el mundo de la gestión empresarial. La primera escuela de marketing de España nació en 1965 y desde entonces ha adaptado su oferta formativo a los nuevos tiempos. Su oferta educativa es amplia, con 26 másteres y 28 programas de posgrado impartidos en sus doce campus en España y uno más en Brasil que ponen un especial énfasis en la innovación, el emprendimiento y la economía digital  Tras los estudiantes españoles, son precisamente los de origen latinoamericano quienes mayor presencia tienen en ESIC. El 51% de sus alumnos de posgrado son internacionales. De ellos, el 64% procede de Latinoamérica. Y son los programas MBA los que más demanda tienen como bien sabe la colombiana Kelly Johanna Sierra. Esta joven de 29 años llegó a Madrid en julio de 2018 para cursar el MBA full time y ahora sueña con conseguir su primera experiencia laboral en España. Cree que de esta manera pondrá en práctica los conocimientos adquiridos durante este tiempo de estudio, lo que podría ser el impulso necesario para crecer y desarrollarse en un ambiente profesional cada vez más globalizado.  ""Consideré diferentes aspectos a la hora de elegir ESIC, como su reconocimiento y su buena posición en los rankings. Además, la escuela cuenta con la acreditación AMBA, que la certifica como una institución de calidad"", relata Kelly. El enfoque en marketing fue otro de los factores decisivos.  La experiencia, prosigue esta estudiante, le ha ayudado a crecer tanto a nivel profesional como a nivel personal, ya que le ha dado la oportunidad de conocer a personas diferentes y con distintas trayectorias que, ""al integrarnos, nos hemos ayudado cada vez más a poder ser mejores"". Kelly incide en la faceta humana abordada en las aulas de ESIC. ""Este es un pilar fundamental en el desarrollo dentro de las organizaciones y ayuda a impulsarlas hacia el éxito. Esto me motiva aún más a continuar creciendo y aportando a nivel económico y social"", afirma.  La alumna insiste en que esa multiculturalidad que ha encontrado en clase le ha sorprendido para bien. ""En cada una de las actividades que desarrollamos en grupo se logra que aprendamos más de las vivencias de los demás y de las realidades a las que cada uno se veía enfrentado en su país de origen"", apunta.  Desde el principio, tuvo química con los profesores y con los compañeros, siempre abiertos a escuchar al resto. Esta cercanía permitió una interacción entre directivos, docentes y estudiantes dentro de una relación cordial, respetuosa y multicultural, que favoreció la generación de conocimiento continuo.  Kelly menciona otro punto importante, la calidad del claustro. Su amplia trayectoria y experiencia facilita que los estudiantes puedan aprender tanto en el campo teórico como en la práctica. ""Sus vivencias hacen de las clases una gran oportunidad de equilibrar estos dos ámbitos"", sostiene.  Un punto que corrobora la colombiana Daniela López, quien está a punto de concluir su MBA full time. Daniela llegó a ESIC en julio del año pasado. ""Es una excelente escuela de negocios, el programa es fabuloso y los profesores, increíbles. Estoy muy satisfecha"", admite. Esta estudiante eligió este máster por su buen posicionamiento en los rankings internacionales de escuelas de negocio. ""No me arrepiento"", constata.  En clase ha convivido con otros estudiantes latinoamericanos procedentes de Venezuela, Perú, Argentina, México y Nicaragua. Es algo que enriquece mucho, opina, porque cada uno aporta perspectivas diferentes en el ámbito de los negocios, y ""eso sirve para que todos aprendamos de todos"". Daniela ha tomado buena nota de temas que le han sorprendido, como los referidos a la cuarta revolución industrial y la sostenibilidad de las empresas, aspectos muy relevantes para su futuro profesional. Su próxima meta: conseguir un trabajo y seguir en España.  ",ESIC: una experiencia transformadora en las aulas,https://elpais.com/sociedad/2019/06/11/actualidad/1560269609_197602.html,elpais,elpais.com,4,267
253580ce2857fce902fa63067d048610,"  No son suficientes. Pero aún hay tiempo para mejorarlos. Es la principal conclusión del análisis que ha hecho la Comisión Europea de los planes de energía y clima que han tenido que presentar los Gobiernos de los 28 países miembros. Bruselas ha pedido este martes a los países que aumenten sus esfuerzos y sean más ""ambiciosos"". En especial, en la implantación de energías renovables, en eficiencia energética y en la lucha, en general, contra los gases de efecto invernadero, responsables del cambio climático según el consenso científico. Los países tienen hasta final de año para presentar los documentos definitivos y atender a las recomendaciones que les ha realizado la Comisión este martes.        MÁS INFORMACIÓN                              Así es el plan climático que España envía a Bruselas: sin carbón, menos nuclear y un 42% de renovables              La ONU urge a tomar medidas drásticas contra el cambio climático                  El plan presentado por España (que, como el resto, abarcan hasta 2030) destaca en la evaluación presentada este martes por la Comisión y en varias ocasiones se pone como ejemplo de buenas prácticas y objetivos ambiciosos. De hecho, fuentes comunitarias han señalado que los cinco planes más ambiciosos son los de Estonia, Dinamarca, Lituania, Portugal y España. En cambio, varios Estados del este de Europa siguen muy rezagados. En sus recomendaciones, la Comisión pide a países como la República Checa, Eslovaquia o Polonia que aumenten su nivel de ambición. Aunque no solo esos Estados se llevan esa reprimenda: también insta a socios como Bélgica o el Reino Unido a elevar sus pretensiones.  Como ha recordado Bruselas en su evaluación final, estos planes son cruciales para combatir el calentamiento. La próxima década será clave en la lucha internacional contra este problema. Porque será cuando se aplique el Acuerdo de París, que obliga a todos sus firmantes a presentar planes de recortes de emisiones de gases de efecto invernadero. Y porque el planeta, según alertan desde el ámbito científico, se está quedando sin tiempo para poder dejar el calentamiento dentro de unos límites manejables. ""No podemos ver [estas medidas] como un coste, sino como una inversión para que la economía europea alcance la neutralidad climática en 2050"", sostuvo el vicepresidente de la Comisión, Maros Sefcovic, responsable de Energía.  Para aplicar el Acuerdo de París la Unión Europea ha ido construyendo un marco legal que incluye los planes de energía y clima que ahora está evaluando. Por primera vez, recordó Sefcovic, cada miembro de la UE ha tenido que presentar el suyo y fijarse los objetivos para la próxima década de reducción de emisiones, de implantación de renovables, de eficiencia... El sector energético acumula alrededor del 80% de todos los gases de efecto invernadero de la economía de la UE, de ahí la importancia de estos planes. La suma de todos esos planes nacionales debe ser suficiente para que el conjunto de Europa cumpla con sus objetivos internacionales: reducir al menos un 40% sus emisiones de gases de efecto invernadero en 2030 respecto a los niveles de 1990.  Pero lo presentado hasta ahora por los Estados no es suficiente, según ha resaltado la Comisión. Tras examinar cada uno de los planes, el ejecutivo comunitario ha formulado a cada uno de los países una batería de recomendaciones, en las que pide más concreción en las medidas o fijar metas más ambiciosas. Los países tienen ahora hasta diciembre para realizar los cambios pertinentes en sus borradores. ""Los planes finales deben reflejar un nivel de ambición aún mayor para que la Unión Europea encauce adecuadamente la lucha contra el cambio climático y la modernización de nuestra economía"", advirtió el comisario de Acción por el Clima y Energía, Miguel Ángel Arias Cañete.  Renovables  Por ejemplo, en renovables el objetivo aprobado ya para el conjunto de la UE para 2030 es llegar, al menos, al 32% de cuota de energías limpias en el consumo final. Pero la suma de todos los planes se queda entre el 30,4% y el 31,9%. Por ello, Bruselas ha hecho un llamamiento a varios Estados a incrementar sus metas de renovables para romper esa brecha.  En el informe la Comisión recuerda que la implantación de renovables es positiva no solo para la lucha contra el calentamiento y la contaminación, sino también para reducir la dependencia energética de la UE. Arias Cañete se mostró convencido de que con las recomendaciones se podrá alcanzar la meta fijada para renovables.  Más preocupado se mostró con el objetivo de eficiencia energética, de al menos un 32% para 2030. Ahí los planes se quedan en el mejor de los casos a al menos dos puntos de ese objetivo y, en el peor de sus casos, a seis. En este caso, todos los países deben revisar al alza sus planes, según la Comisión. ""Hay margen para la mejora"", recordó el comisario, quien pese a todo quiso recordar que esa evaluación permite que la UE pueda avanzar hacia los objetivos marcados con un sistema ""completamente integrado"". Según la evaluación de Bruselas, solo tres países cumplen de forma ""suficiente"" con todos los objetivos fijados en consumo de energía: España, Italia y Luxemburgo.  España está en el grupo de los más cumplidores, por lo completo de su programa y por la ambición de las metas planteadas. Quizás el ejemplo más esclarecedor sea el de la cuota de renovables. A España, según el reparto teórico de esfuerzos realizado por Bruselas, le correspondería llegar en 2030 a un 32% de renovables; pero el compromiso del Gobierno actual es un 40%. Bruselas destaca también a Dinamarca, Estonia, Lituania y Portugal.                            España fue el último de los socios europeos en presentar este plan de energía y clima, pero un análisis de la organización European Climate Foundation  ya lo calificaba como el mejor de los 28. Aquel informe también advertía de que los 28 se estaban quedando cortos, como ahora ratifica la Comisión.  El Ejecutivo comunitario, sin embargo, cree que es el momento de poner luces largas y mirar hacia 2050 como fecha para la descarbonización total de la economía europea. Por ello, Arias Cañete reclamó que ""tras los últimos cambios de Alemania"" (la canciller Angela Merkel se mostró abierta a la consecución de ese objetivo), varios países ""presionen"" en el Consejo Europeo de este jueves hacia esa dirección. El primer borrador de conclusiones de esa reunión, que puede estar aún sujeto a múltiples cambio, apunta que la UE debe fijar a principios de 2020 una estrategia sobre la que pueda llevarse a cabo una ""transición justa"" hacia esa neutralidad climática, aunque de momento los países miembros evitan poner fecha a ese horizonte.          Adiós al carbón en ocho países      El informe de la Comisión Europea resalta que ocho países han presentado calendarios concretos para cerrar sus plantas eléctricas que queman carbón. “Francia tiene intención de hacerlo en 2022. Italia e Irlanda en 2025. Dinamarca, España, Holanda, Portugal y Finlandia en 2030”, resalta el análisis.  El informe también menciona que Alemania ha comunicado su intención de ponerle fecha al fin del carbón para generar electricidad. Pero el Gobierno alemán maneja el 2038 como fecha para ese final.        ",Bruselas da seis meses a los Veintiocho para mejorar sus planes climáticos,https://elpais.com/sociedad/2019/06/18/actualidad/1560851405_492288.html,elpais,elpais.com,7,458
88fba2b9d1d54f52f090fa8132751cb4,"  La medida adoptada por el Gobierno regional —una alianza del Partido Socialdemócrata (SPD), Los Verdes y los poscomunistas de Die Linke (La Izquierda)— afecta a 1,6 millones de viviendas y cuenta con el rechazo total de la oposición (democristianos, liberales y la ultraderechista Alternativa para Alemania), más cercanos a las tesis del sector inmobiliario.        MÁS INFORMACIÓN              Los conflictos por alquileres se dispararon en 2018: hubo un 31% más de litigios              El miedo de los caseros atasca el alquiler de vivienda: lo ponen más difícil y caro              La tarea de la vivienda queda pendiente                  El proyecto de ley debería estar listo el 17 de octubre para que el Parlamento regional lo apruebe a tiempo. Katrin Lompscher enfatizó que la ley recogerá una regulación concreta para los propietarios en dificultades económicas. El Gobierno berlinés quiere poner fin al rápido aumento de los alquileres y, al mismo tiempo, ganar tiempo para la construcción de nuevas viviendas.  La ley también contempla introducir un límite máximo de alquiler. El importe aún no está claro, pero los alquileres que superen este límite tendrán que ser reducidos en el momento de la solicitud.  Está previsto que la ley entre en vigor en enero de 2020. Pero para evitar nuevos aumentos de precios, sus efectos serán retroactivos a partir de la resolución del Parlamento regional aprobada este martes. En caso de infracción, se podrán imponer multas de hasta 500.000 euros.  El plan ya había dado lugar a un debate a escala nacional. El líder provisional del SPD, Thorsten Schäfer-Gümbel, anunció que el Gobierno de gran coalición —formado por la CDU de Angela Merkel, sus aliados bávaros de la CSU y el SPD— estaría a favor de un límite al precio del alquiler en toda Alemania. Pero el ministro del Interior, Horst Seehofer (CSU), criticó la decisión. La asociación de propietarios Haus & Grund incluso pidió a los caseros que aumentaran los alquileres antes de la aprobación de la medida. La Asociación de Arrendatarios de Berlín ha registrado un fuerte aumento de los aumentos de alquiler en el capital en los últimos días.  El Comité Central de Bienes Raíces criticó duramente la decisión. “La capital se está amurallando. El panorama político está inquietando a los inversores, de los que Berlín depende”, explicó su presidente, Andreas Mattner. La Asociación de Empresas de Vivienda de Berlín y Brandeburgo se sumó a las críticas y describió el límite de alquiler como un “límite de inversión”.  Según la Oficina de Estadísticas de Berlín, más de 3,7 millones de personas viven en la capital, que dispone de una oferta de 1.906.400 viviendas, de las cuales más de 1,6 millones son alquiladas. De estas, 105.500 son viviendas sociales con un alquiler neto de menos de 6,5 euros por metro cuadrado.  Uno de los dramas del mercado inmobiliario berlinés es la crónica falta de viviendas nuevas. En 2018 se construyeron 16.706 nuevos apartamentos, pero para acoger a las 40.000 personas que cada año llegan a la ciudad harían falta más de 20.000.  También para acabar con la especulación salvaje se lanzó en marzo una consulta popular que pedía la expropiación a los grandes consorcios inmobiliarios. La iniciativa aún esta en marcha y para prosperar deberá recoger 170.000 firmas en seis meses. Las expropiaciones están amparadas por la Constitución de Alemania “solo por motivos del bien común”. “Podrá ser efectuada solo por ley o en virtud de una ley que establezca el modo y el monto de la indemnización”, dice la Ley Fundamental.  ",Berlín congela el precio de los alquileres durante cinco años,https://elpais.com/economia/2019/06/18/actualidad/1560878482_152610.html,elpais,elpais.com,4,225
