uid,body,title,url,newspaper_uid,host,n_tokens_title,n_tokens_body
2a8642cf135a527837c2bfa5f7737707,"  Una controversia por supuesta corrupción envuelve a Juan Guaidó, jefe del Parlamento y reconocido como presidente interino de Venezuela por más de medio centenar de países. Los emisarios del jefe de la Asamblea Nacional y principal figura opositora para atender a centenares de soldados exiliados en la ciudad de Cúcuta (Colombia) están siendo investigados por supuesta malversación fondos. La denuncia, divulgada por el portal de noticias PanAm Post el pasado viernes, empujó a Guaidó a solicitar a la Fiscalía colombiana una investigación para establecer la culpabilidad en el desvío de dinero. Pero, en paralelo, el Gobierno de Nicolás Maduro aprovechó para culparle a él del presunto desfalco.          //<![CDATA[      // Hash con los datos para el reproductor de audio      var datosAudio_638 = {};      datosAudio_638.anchoPlayer   = 460;      datosAudio_638.altoPlayer    = 100;      datosAudio_638.caratula      = '';        datosAudio_638.tipo          = 'mediateca_audio';      datosAudio_638.id_multimedia = '20190504947336';      datosAudio_638.urlNoticia    = '/internacional/2019/06/18/america/1560885159_828757.html';      datosAudio_638.class    = 'playerMPEPA';              datosAudio_638.tagsIds               = '195207,74854,77947,177028,83879,82947,81609';      datosAudio_638.tagsNombreNormalizado = 'juan_gerardo_guaido_marquez_a,tarek_williams_saab_a,venezuela_a,nicolas_maduro_moros_a,sudamerica_a,latinoamerica_a,america_a';      datosAudio_638.keywordsAudio         = 'internacional,america';        datosAudio_638.tituloPlayer  = '';      datosAudio_638.duracionAudio = '1033488';      datosAudio_638.portal_creacion  = 'internacional';      datosAudio_638.seccion_creacion = 'america';      datosAudio_638.un_creacion      = 'ep';                // Llamada para pintar el reproductor de audio          reproductorMultimedia(datosAudio_638);        //]]>                  El fiscal general de Venezuela, Tarek William Saab, ordenó este martes iniciar una investigación penal contra varios opositores. “Este grave hecho evidencia que el diputado Guaidó dispone de fondos de la República, robados de cuentas pertenecientes al Estado venezolano por autoridades extranjeras, y que estos fondos se están administrando sin transparencia alguna”, aseguró. Desde que estalló el escándalo, el presidente de la Asamblea Nacional clamó por “transparencia” para diferenciarse de los Gobiernos chavistas, inmersos en diferentes tramas de corrupción.  La petición de investigación formulada por el propio Guaidó fue introducida minutos antes del pronunciamiento de Saab por parte de su embajador en Colombia, Humberto Calderón Berti, que consignó un informe con posibles evidencias a fiscales en Bogotá. El diplomático asegura que desde hace dos meses emprendió una averiguación propia por sospechas de corrupción, con una información recibida desde la Dirección General de Inteligencia de Colombia como punto de partida. “En nuestro país se ha acostumbrado, después de 20 años de régimen dictatorial, a hacer caso omiso a los hechos protuberantes de corrupción. Nosotros no podemos permitir eso. Nuestro mensaje al país es que somos distintos (…) actuaremos con absoluta transparencia en defensa de los intereses de la población venezolana”, dijo a la prensa.  Los acusados son Rossana Barrera Castillo y Kevin Rojas Peñaloza, ambos militantes de Voluntad Popular (VP, el partido fundado por Leopoldo López), que supuestamente se enriquecieron después de recibir fondos para atender a los militares y policías fugados de Venezuela por desobedecer órdenes del Gobierno de Maduro. Los dos fueron imputados por legitimación de capitales y corrupción a los opositores en Caracas. “Ellos son los autores materiales del hecho, pero Guaidó es el autor intelectual”, afirmó Saab.        MÁS INFORMACIÓN              Tarek William Saab, de activista tibio a chavista fiel              El chavismo lleva a 22 diputados al exilio, la clandestinidad o la cárcel en el último mes              Venezuela emite nuevos billetes ante la incontrolable inflación                  El oficialismo ha aprovechado la controversia para atacar a sus adversarios. El lunes, Jorge Rodríguez, ministro venezolano de Comunicación e Información, ratificó la denuncia de presunto desfalco. “Voluntad Popular quiere robar solo, esa es la razón por la que la oposición está dividida: los militantes de ese grupo terrorista se están quedando con toda la plata de la supuesta ayuda humanitaria”, dijo.  Su versión es que Guaidó se apropió de hasta tres millones de dólares recaudados en un multitudinario concierto, celebrado el 22 de febrero en Cúcuta, para atender a los venezolanos en condiciones de vulnerabilidad. Pero en un comunicado la fundación Aid Live, coordinadora del evento, aclaró que no entregó recursos a ningún Gobierno ni partido político y que, por contra, el dinero está destinado a organizaciones no gubernamentales.  Entretanto, Guaidó informó de que los sospechosos de corrupción, Barrera y Rojas, fueron separados de sus cargos. Su intención es iniciar una investigación, en paralelo a la justicia colombiana, sobre el caso desde la Asamblea Nacional y con el apoyo de la prestigiosa ONG Transparencia Internacional. Además, el opositor inició gestiones para nombrar un contralor especial que represente a su Ejecutivo interino. Estos propósitos y la creación de una comisión para el monitoreo de la ayuda humanitaria se aprobaron en un acuerdo firmado por el Legislativo.  Más allá de la contienda política, las condiciones de los venezolanos siguen deteriorándose día a día. Siete centenares de oficiales cruzaron la frontera desde el 23 de febrero, día del intento fallido de ingreso de donativos internacionales al país petrolero, ilusionados con la promesa de mejores condiciones de vida. En Cúcuta se alojaron en siete hoteles, dos de ellos pagados por Guaidó y el resto por el Gobierno colombiano y la Agencia de Naciones Unidas para los Refugiados (Acnur).  Desde entonces, sin embargo, ya se han producido dos desalojos por deudas. La inestabilidad ha provocado que muchos disidentes, acompañados por sus familias, decidieran abandonar Colombia hacia inciertas rutas. Pero todavía otros permanecen en un limbo. El lunes, ocho de los desertores de la Fuerza Armada de Venezuela comenzaron una campaña, en la plataforma Gofundme, para recaudar miles de dólares que le permitan viajar con sus familias a Chile e instalarse durante el primer mes.  ",Venezuela abre una investigación contra militantes opositores por supuesta corrupción,https://elpais.com/internacional/2019/06/18/america/1560885159_828757.html,elpais,elpais.com,5,351
f5555a7faf214854876ffce62f9551ba,"  Donald Trump lanzó este martes por la noche su campaña para la reelección en 2020 pidiendo el voto contra “la izquierda radical”, rescatando anhelos y fantasmas de la campaña de hace cuatro años, incluida Hillary Clinton, fuera de la ecuación. Rodeado de miles de seguidores en un pabellón de Orlando, el republicano sacó pecho por la buena marcha de la economía, pero los miedos movilizan más que las satisfacciones, así que cargó duramente contra la inmigración ilegal. También acusó a los demócratas de no haber aceptado su victoria en 2016 y de haber provocado todas las investigaciones que se ciernen sobre su figura. El republicano es el ganador que debe preservar el título, pero consiguió que pareciera una revancha. “Lo único que estos políticos corruptos entenderán es un terremoto en las urnas”, clamó. En la calle, otras placas sísmicas se movían: miembros del grupo de ultraderecha Proud Boys se cruzaban gritos contra manifestantes anti-Trump.  La cola impresionaba a las cinco de la tarde. Recorría varias manzanas, sugiriendo que algunos quedarían fuera del estadio —con capacidad para 20.000 personas— y seguirían el espectáculo en las pantallas gigantes en los jardines exteriores. Al final, sin embargo, casi todo el mundo pudo entrar y fuera la cosa murió en cuanto empezó a llover. “¿Usted ve esta fila que espera para entrar? A la gente le molesta que la gente se la salte y eso es lo que está pasando con la inmigración. Mis abuelos vinieron aquí haciendo todos los papeles”, decía a la entrada Juan Chacón, de 38 años, nacido en Los Ángeles y de origen mexicano.        MÁS INFORMACIÓN                              Donald Trump no despidió al fiscal Mueller porque “a Nixon no le fue bien así”              ¿Ganará Trump de nuevo? Pregunte en Wilkes-Barre                  No resulta tan exótico como parece encontrarse a un nieto de inmigrantes con nombre hispano en un mitin del republicano, los mítines son precisamente ese momento en el que siempre aparece alguien con un cartel que dice ""Hispanos por Trump"" o ""Veteranos por Trump"" o ""Afroamericanos por Trump"" o ""Mujeres por Trump"" o ""LGBT por Trump""... Este martes solo faltaba el de ""Demócratas por Trump"". A cualquiera que se le preguntara por qué iban a votar de nuevo, lo primero que señalaban era la creación de empleo, lo segundo, algo más gaseoso: “Es una gran presidente” o “este país estaba muy mal antes”. ¿Qué quiere decir exactamente? Y entonces solía salir la inmigración.  Trump la demonizó en su discurso a varios niveles y acusó a los demócratas de “traicionar a la clase media americana” con su “política de fronteras abiertas”. Aseguró que los inmigrantes irregulares provocan que los trabajadores estadounidenses vean mermados sus salarios por la competencia que suponen y que los niños en las escuelas “viven amenazados por los miembros de bandas como la MS-13”. Nombró el muro que prometió construir en México, aseguró que se estaba haciendo, pero presumió poco de ello, bloqueado como está el proyecto por el Congreso. La frontera sur experimenta desde hace meses la llegada masiva de emigrantes sin papeles, sobre todo por el aumento de familias centroamericanas que huyen de la miseria y la violencia. La imagen de caravanas de emigrantes cruzando México para llegar a Estados Unidos a pedir asilo se han convertido en munición electoral para el republicano.  El discurso de este martes fue especialmente hiperbólico. La victoria de 2016 había sido “la mejor de la historia”: el lema electoral, Make America great again —“Haz América grande de nuevo”—, el más redondo del mundo; y la investigación a cargo del fiscal especial Robert S. Mueller sobre la trama rusa (la injerencia electoral del Kremlin y la posible colaboración del equipo de Trump), el peor ataque contra un presidente. Todo es superlativo en los mítines del neoyorquino. Mueller consideró probada la injerencia pero no halló pruebas de connivencia entre su círculo y Moscú. El presidente acusó a la oposición de no aceptar la derrota: ""A nuestros opositores demócratas radicales les mueve el odio y la rabia. Quieren destruiros y quien destruir nuestro país tal y como lo conocemos"". Tachó a la prensa de “mentirosa” y denunció: “Llevamos dos años y medio bajo asedio”.            Del Make al Keep America great again #TrumpOrlandoRally pic.twitter.com/xY7IbehrwA  — Amanda Mars (@amanda_mars) 18 de junio de 2019          Entre los seguidores, el ambiente era una mezcla de euforia y orgullo. Más que un mitin, la noche se convirtió especie de autohomenaje del trumpismo, acto de afirmación. “Haz que los liberales lloren de nuevo”, llevaban como lema algunas camisetas. “Trump es el puñetero presidente”, llevaban otras. Los miembros del grupo ultra Proud Boys gritaban con altavoz a los manifestantes anti-Trump que Trump era su presidente y lo iba a ser cuatro años más. Estos respondían con acusaciones de corrupción y llamamientos al impeachment (destitución).  Hace cuatro años, cuando lanzó su campaña a la presidencia en Nueva York, ya agitó la bandera contra los indocumentados, acusando a México de estar enviado a la frontera a sus “violadores”. Pero entonces era Trump, el showman, el presentador de programas de telerrealidad, el rico fanfarrón, el famoso estridente. Una decena de republicanos con muchas más probabilidades entonces —un Bush (Jeb), un senador muy consolidado en Washington (Ted Cruz), por ejemplo— se habían presentado a las primarias y la intentona de este constructor parecía el gran chiste de la campaña. La era Trump no solo es una realidad hoy, sino que tiene opciones durar dos mandatos.  Ahora son los demócratas los que tienen un jardín de 20 aspirantes para la candidatura a la presidencia. Así que Trump, a falta de un rival concreto al que dirigir las naves, dejó caer alguna que otra puya al “dormilón” Joe Biden, y al “loco” Bernie Sanders, los que lideran las encuestas. Pero el grueso del ataque, aunque parezca sorprendente, se lo llevó Hillary Clinton, a la que derrotó en 2016. Trump recordó varias batallitas de la campaña anterior, desde la metedura de pata de la excandidata, cuando llamó “deplorables” a los trumpistas, hasta el caso del uso de un servidor privado de correo cuando era secretaria de Estado.  El republicano lanzó algún guiño a los conservadores cristianos, prometiendo prohibir el aborto “en últimos estadios de gestación” en un momento en el que este derecho se ha convertido en una batalla nacional. Por lo demás, todo parecía un dejà vu. Hasta el lema solo ha variado a “Mantengamos América grande”. Un remake.  ",Trump pide a los votantes que se rebelen en contra de la “izquierda radical”en las elecciones de 2020,https://elpais.com/internacional/2019/06/19/estados_unidos/1560898947_787665.html,elpais,elpais.com,5,409
d7e5c5b141c9a3fa837339bcdd74fd90,"  Es increíble la cantidad de cosas apasionantes que hay en el mundo de las que no tenemos (yo al menos) ni idea. Hasta la semana pasada no sabía nada, pero nada oigan, del reino secreto de los hombres serpiente o Wakaiolas de los wanyamwesi de Tanganika, ni de su rey, el gran Kalola. Ignoraba asimismo que un occidental, el naturalista estadounidense Fred Carnochan no solo se había introducido en esa extraña comunidad sino que había llegado a alcanzar en los años treinta del pasado siglo un rango notable en su seno.  De esa historia real que parece salida de la imaginación de un Rider Haggard, lo he descubierto todo no sobre el terreno - el mundo ha cambiado mucho desde que existía Tanganika y no eras nadie sin salacot-, sino, como suele suceder, en un libro. Un libro, he de recalcar, notable y apasionante, L’empire des serpents, traducción francesa (Stock, 1946) del original The Empire of the Snakes (Stokes, 1935) que adquirí en los bouquinistes de París el miércoles pasado en un verdadero acto de fe, pues el ejemplar estaba minuciosamente envuelto en plástico y la vendedora, a la que no le debí parecer un cliente fiable, no me dejó retirarle la protección, aparte de que no me sacaba el ojo de encima. Las escasas líneas en la contraportada, sin embargo, prometían. “Fred Carnochan fue el primer hombre blanco en explorar el imperio de los Wakaiola. Admitido en el entorno de Kalola, el emperador de los Hombres Serpiente de Tanganika, fue iniciado en asuntos secretos de ese pueblo extraño, y a su extraordinaria medicina”. El somero escrito añadía que “Carnochan nos arrastra a un viaje alucinante. Y si consigue hacer partícipe al lector de su asombro y fascinación por una ciencia y una cultura que inspiran el más grande respeto, esta obra habrá cumplido su propósito”. A ver: sin con un texto así no te tiras de cabeza al libro es que no tienes alma aventurera. Además solo costaba cinco euros.  Fue abrirlo, tras quitarle el plástico con manos temblorosas como se desnuda a una novia, y no poder parar de leer. Yo sabía algunas cosas de los cultos y costumbres con serpientes en África, especialmente lo relacionado en Dahomey con las pitones sagradas, a las que se veneraba, se las paseaba en procesión y cuya profanación era castigada con la muerte. Y también conocía a Constantine John Philip Ionides, que se movió entre serpientes en una zona y una época muy parecidas a las de Carnochan; pero de éste y de su peripecia no había oído hablar.                   Un manipulador de serpientes africano.            El neoyorquino Frederic Grosvenor Carnochan (1890-1952) arribó a Tanganika en 1926 como parte de la expedición Smithsonian-Chrysler destinada a conseguir animales para el zoo de Washington. Tras fracasar en la empresa de atrapar serpientes (y mira que será por serpientes en África) oyó hablar de unos misteriosos nativos que eran los únicos que tenían el derecho tribal de capturarlas o matarlas. Efectivamente, los Hombres Serpiente. Descubrió que eran los miembros de un sacerdocio secreto que poseían un extraordinario dominio sobre esos reptiles y eran capaces de manipular hasta las especies más letales sin miedo a sus mordeduras. Se hacían invulnerables, averiguó, gracias al dominio de pócimas y ungüentos que los inmunizaban mediante una primitiva sueroterapia contra el veneno hasta de criaturas como la implacable víbora sopladora o koboko (Bitis arietans), la que más muertes causa en África, o la cobra de labios negros, que es cosa de verse. Gracias a ellos logró recolectar más de cinco mil ejemplares. En una ocasión vio cómo un hombre serpiente volteaba sobre su cabeza una sopladora con la mala fortuna de que el bicho le mordió al negro en la cara: un suceso semejante debería acarrearle la muerte casi inmediata, pero no tuvo consecuencia alguna.  Lo que cuenta Carnochan, que logró introducirse en la sociedad secreta, es en buena parte un relato de iniciación, curiosamente muy parecido al del ínclito Carlos Castaneda con el chamán yaqui Don Juan (Una realidad aparte, Viaje a Itxlán, Relatos de poder, ¿recuerdan?), y también, como este, una hermosa historia de amistad: la que desarrolla el estadounidense con, primero, el príncipe Nyoka (""serpiente"" en swahili), que es como el Umbopa de Las minas del rey Salomón, y luego con su tío, el emperador o mutemi Kalola mientras asciende siete de los ocho grados de la sociedad secreta, incluido el de “hacedor de lluvia”. Kalola es un personaje sensacional , anciano y enjuto, viste un sombrero verde coronado por una pluma de avestruz, un manto de piel de león y un viejo cinturón con cartuchera de las fuerzas imperiales alemanas que luce el lema “Got mit uns”. La gente se lanza al suelo en señal de respeto cuando pasa.  Los hombres serpiente (de los que no pueden formar parte mujeres excepto una, la que les prepara su cerveza, la así llamada madre de las serpientes o Ni nabo (!), tienen una hermandad paralela femenina, la Bagota, consagrada en plan Me Too avant la lettre a envenenar a los malos maridos que maltratan a sus esposas. De esta segunda cofradía solo pueden ser miembros mujeres o hermanos varones gemelos de una mujer, pues los wanyamwesi creen que los gemelos posee una sola alma y no saben en cuál de los dos está. Los Wakaiola tienen un lugar donde se castiga terriblemente a los traidores que airean sus secretos, Lubuga wa wasasi, ""el dominio de los imbéciles"".          Carnochan oye hablar de un poderoso B’wana Zoka o Señor Serpiente al que mencionan con respeto hasta en el tam-tam de los tambores. Descubre que se trata de él mismo.        Kalola adentra a Carnochan en los secretos de los hombres serpiente y pone a su disposición la farmacopea que emplean y los hace temidos pues también pueden sujetar la voluntad de una persona hasta convertirla en algo parecido a un zombi o un robot. El neoyorquino prueba una sustancia, el kingo, que durante tres horas le hace incapaz de controlar su cuerpo y su mente. De manera más prosaica, aprende que las plumas rojas del turaco pulverizadas son un magnífico expectorante por su contenido en sal de cobre. Las glándulas anales del cocodrilo, en cambio, son muy peligrosas, y se las ha de manipular con cuidado (imagino que sobre todo cuando el animal está vivo).  Con el tiempo, Carnochan oye hablar de un poderoso B’wana Zoka o señor serpiente al que mencionan con respeto hasta en el tam-tam de los tambores. Descubre que se trata de él mismo. Su nombre secreto de hermandad será sin embargo otro: Ndilema, Joven Pitón.  El naturalista devenido miembro de la sociedad secreta se despedirá de África y de su amigo Kalola en una escena inolvidable en la que al viejo y correoso rey de los hombres serpiente le saltan las lágrimas. “Mi corazón te acompaña, mi espíritu marchará contigo”, dice al blanco tras regalarle su posesión más preciada, una estatuilla que había pertenecido al rey zulú Chaka y a un brujo wangoni. “Supe mucho más tarde de la muerte de Kalola”, escribe en un postfacio Carnochan; “la noticia me entristeció pero siento que de alguna manera su espíritu, como el de los grandes hombres de todas las razas y de todas las creencias, prosigue su camino”. Una historia muy hermosa. ¿Se puede pedir más por cinco euros?                            ",Entre los misteriosos hombres serpiente de Tanganika,https://elpais.com/cultura/2019/06/18/actualidad/1560859866_044899.html,elpais,elpais.com,4,518
