uid,body,title,url,newspaper_uid,host,n_tokens_title,n_tokens_body
d13b6f0fc9c069fa7093d3d8a31e49f9,"  La primera escuela de marketing de España nació en 1965 y a lo largo de sus más de 50 años de vida se ha convertido no solo en una referencia en este ámbito de los negocios, sino que va mucho más allá. En sus doce campus en España, ESIC Business & Marketing School ofrece la más completa oferta educativa de Europa en el área de la gestión empresarial y el marketing con especial foco en la innovación, el emprendimiento y la economía digital –es pionero en esta temática en España–, tanto en el área de grado como de posgrado.  Estos acuerdos académicos e institucionales van desde el intercambio de profesorado y colaboración en proyectos de investigación hasta el diseño de formación conjunta para la impartición de programas Executive y programas máster. De esa manera, la escuela favorece el aprendizaje en un entorno multicultural que contribuye al desarrollo de la excelencia del alumnado.  ""Hemos reforzado nuestra presencia en Latinoamérica. Con los años el número de antiguos alumnos de la región ha aumentado notablemente, por lo que nuestra acción directa en la región también ha aumentado. Somos miembros activos de CLADEA (Consejo Latinoamericano de Escuelas de Administración), una red internacional que reúne a instituciones de educación superior y organizaciones dedicadas a la enseñanza e investigación en el campo de la administración. Participamos en ferias de formación internacional, congresos especializados para fomentar la innovación en el sector de la educación superior, hemos aumentado la red de convenios con universidades y escuelas en esos países para favorecer el intercambio de visiones y experiencias. Por último, hemos reforzado nuestra presencia en la zona a través de acciones de posicionamiento"", relata Raquel Iglesias, directora de Desarrollo Internacional de ESIC.  Tras los estudiantes españoles, son precisamente los de origen latinoamericano quienes mayor presencia tienen en los 26 másteres y 28 programas de posgrado que se imparten en ESIC. El 51% de sus alumnos de posgrado son internacionales. De ellos, el 64% procede de Latinoamérica. La distribución varía en el caso de los seis estudios de grado que imparte el centro, ya que se trata de licenciaturas que duran entre cuatro y cinco años.  Son los programas MBA los más demandados por los alumnos. De entre ellos sobresale, por su innovación académica, el International MBA, que combina la administración de empresas con una impronta de marketing y economía digital muy potente. Este programa facilita, además, un recorrido internacional integrado en el mismo, y el alumno tiene la posibilidad de disfrutar su experiencia profesional en China, añadiendo Estados Unidos en el caso de querer obtener la titulación del Global MBA.  Apoyo continuo al alumnado  La vinculación que establece el centro con los estudiantes que vienen desde el otro lado del Atlántico es muy cercana desde el principio. Lo primero que hacen los alumnos al llegar a ESIC es participar en una semana de introducción a los programas. El objetivo es que aterricen de manera progresiva, sin presión, y que en esos días conozcan al personal, los servicios, el campus... La escuela está trabajando ahora en el programa ""buddy program"", en el que un estudiante español de ESIC acompañará durante unos días al recién llegado y le ayudará en su integración. Además, existe una Oficina Internacional, que ofrece apoyo continuo al alumno durante su periodo de formación.  ""Creemos en el crecimiento internacional y en la inversión en nuevos mercados, principalmente en Latinoamérica, por nuestra proximidad cultural y el idioma"", confirma Iglesias. El hecho de tener establecidos convenios con escuelas y universidades de esta región del continente americano da confianza a estos estudiantes, que por lo general conocen ESIC por referencias de antiguos alumnos. ""Nuestro buen posicionamiento en rankings, las certificaciones y acreditaciones y las posibilidades de intercambios internacionales"", añade la responsable de Desarrollo Internacional, son otras de las características que más valoran los estudiantes latinoamericanos a la hora de elegir este centro universitario.  Además de potenciar su perfil profesional y ampliar su red de networking, estos alumnos son conscientes de que una titulación europea les abre nuevas puertas gracias a su formación global. Y saben que el hecho de completar sus prácticas en compañías muy especializadas en el sector puede diferenciar sus currículums. En ese sentido, la relación de ESIC con el tejido empresarial es muy fructífera. El centro tiene convenios con más de 3.000 empresas a través de su Unidad de Desarrollo Profesional. El 94% de las prácticas son remuneradas, y más del 30% renueva el convenio original de prácticas. Además, los más de 63.000 antiguos alumnos de ESIC cuentan con una bolsa de empleo de por vida.  La cercanía del profesorado es otro aspecto muy valorado por los alumnos. El claustro cuenta con dos perfiles. Uno es puramente académico, con docentes muy involucrados en la investigación. El resto está formado por profesionales y expertos en management, marketing y digital que ocupan cargos de responsabilidad en sus compañías y combinan esta actividad con la docente. Eso les sirve para aportar su experiencia en las aulas y permiten contrastar las teorías con la práctica para favorecer el pensamiento crítico entre el alumnado.  A ello se le debe sumar la amplia oferta cultural y extracurricular del centro, que cuenta con un club deportivo, aula de teatro y el área de voluntariado Más ESIC. Asimismo, organiza eventos relevantes como MEET Up, Hoy es Marketing – el mayor encuentro para profesionales del mundo del marketing, el management y la economía digital en España– o el Digital Summit, entre otros. Siempre con un mismo objetivo, que es formar a profesionales capaces de crear empresas o desempeñar en ellas un trabajo directivo o técnico, sustentado en dos valores que son la base de ESIC: compromiso y cercanía.  ","ESIC, un referente del marketing y la economía digital",https://elpais.com/sociedad/2019/06/03/actualidad/1559521064_907015.html,elpais,elpais.com,4,372
048c1c7f205d0cadec3b8e532f62ada8,"        MÁS INFORMACIÓN              Bryce Echenique: “Estoy en la edad de no hacer nada”              'Un mundo para Julius' llega al cine              Bryce Echenique: de plagios y premios              “Hay algunos que quieren todos los premios para ellos... ¡que se jodan!”                  La taquilla número 1.216 de la Caja de las Letras, en el Instituto Cervantes, ya contiene el legado que entregó ayer en mano el escritor peruano  Alfredo Bryce Echenique, de 80 años. En el interior de la caja dejó nueve ejemplares, en ediciones en español, ruso, japonés, francés o italiano, de algunas de sus obras, como Un mundo para Julius, la primera y más celebrada, de 1970, y la última, la tercera entrega de sus Permiso para retirarme. Antimemorias, publicada en abril de este año. Un libro que, como prometió ayer el limeño, será el último: “El título es una declaración de principios. No tengo pensado otro proyecto”. Instantes después introdujo esos volúmenes en la caja que tiene su nombre y en la que algún día hubo dinero (la sede del Cervantes fue la del Banco Central). Hoy contiene libros.  Bryce, de traje gris oscuro y corbata roja, ha decidido que su caja se abra dentro de un siglo, el 18 de junio de 2119, fecha en la que, como añadió el director del Instituto Cervantes, Luis García Montero, “se podrá saber las dedicatorias a sus amigos que hay en estos libros”. Algunos de ellos estaban a su alrededor, por lo que el autor, “muy agradecido”, les dijo que estos “habían estado a la superaltura”. Preguntado por el caso de sus plagios de artículos de prensa, por el que fue condenado a una multa de 42.000 euros en Perú, en 2009, aseguró que recurrió y que la Fiscalía de Perú le absolvió “completamente”.  El homenaje al limeño continuó con una mesa redonda en la que participaron, además de García Montero, la escritora Almudena Grandes, el cantautor Joaquín Sabina (que desde hace años lo considera su “hermano”), el editor Jesús García Sánchez, el escritor José Esteban y el consejero cultural de la Embajada del Perú, Alonso Ruiz Rosas, moderados por la profesora Ana Pellicer. Una reunión con conocidos porque, como dijo Bryce, “la patria son unos cuantos amigos y unos cuantos paisajes inolvidables”. El escritor fue acogido con aplausos por el público que llenaba el salón de actos y que, desde una hora antes de que empezara el acto, hacía cola en la calle para escucharlo. Todos los participantes confiaron en que reconsidere su decisión de no escribir más.  Grandes afirmó que a Bryce “es uno de los escritores a los que más homenajes haría”. “Y de los que más me ha influido. Un mundo para Julius construyó un mundo para mí”, añadió la autora, colaboradora de EL PAÍS.  ",Bryce Echenique se retira: “No tengo pensado otro proyecto”,https://elpais.com/cultura/2019/06/18/actualidad/1560859971_063456.html,elpais,elpais.com,4,165
6942ecb13fdd7572ba4e944e0487156c,"          IN ENGLISH                In Spain, parties argue over the meaning of “cooperation government”                  Al contrario de lo que era previsible, las reuniones públicas fueron mucho mejor que el primer encuentro teóricamente discreto —la noticia fue adelantada este martes por eldiario.es— en La Moncloa. Hubo dos citas con fotógrafos, y fueron bastante bien, según fuentes de los dos sectores. Y hubo un primer encuentro sin cámaras y todo indica que fue bastante mal, aunque la negociación seguirá porque ambos están condenados a entenderse.          //<![CDATA[      // Hash con los datos para el reproductor de audio      var datosAudio_989 = {};      datosAudio_989.anchoPlayer   = 460;      datosAudio_989.altoPlayer    = 100;      datosAudio_989.caratula      = '';        datosAudio_989.tipo          = 'mediateca_audio';      datosAudio_989.id_multimedia = '2019061965628295';      datosAudio_989.urlNoticia    = '/politica/2019/06/18/actualidad/1560883689_575328.html';      datosAudio_989.class    = 'playerMPEPA';              datosAudio_989.tagsIds               = '63085,140540,159753,137839,63084,83560,35950,66682,23440,81163,137840,23441,28501,63501,35944,9554,65941,9558';      datosAudio_989.tagsNombreNormalizado = 'pactos_postelectorales_a,pedro_sanchez_perez_castejon_a,unidos_podemos_a,pablo_iglesias_turrion_a,pactos_politicos_a,presidencia_gobierno_a,gobierno_espana_a,psoe_partido_socialista_obrero_espanol_a,coaliciones_electorales_a,iu_izquierda_unida_a,podemos_a,coaliciones_politicas_a,elecciones_a,partidos_politicos_a,gobierno_a,administracion_estado_a,politica_a,administracion_publica_a';      datosAudio_989.keywordsAudio         = 'politica,actualidad';        datosAudio_989.tituloPlayer  = '';      datosAudio_989.duracionAudio = '156960';      datosAudio_989.portal_creacion  = 'politica';      datosAudio_989.seccion_creacion = 'actualidad';      datosAudio_989.un_creacion      = 'ep';                // Llamada para pintar el reproductor de audio          reproductorMultimedia(datosAudio_989);        //]]>                  El problema llegó cuando se pasó de las palabras a su significado. Para Podemos, Gobierno de cooperación es muy similar a Gobierno de coalición: un Ejecutivo conjunto en el que la formación de Iglesias tenga una tercera parte de los ministros que nombre el PSOE, una relación similar a la que hay entre los diputados de uno y otro: 123 a 42. Pero para el PSOE Gobierno de cooperación es una cosa muy diferente del que se acaba de acordar en la Comunidad Valenciana, donde Podemos tiene una vicepresidencia.  Sánchez, según fuentes conocedoras de la reunión, trasladó a Iglesias que el significado de ese Gobierno de cooperación implicaría tres elementos importantes: por un lado, Unidas Podemos sería el socio prioritario del Ejecutivo, lo que implicaría que Sánchez descansaría en ellos las decisiones y las negociaciones clave y no buscaría la geometría variable con otros grupos de la que se hablaba tras el 28-A. Por otro, se firmaría un acuerdo de investidura pactado entre los dos que marcaría toda la agenda política.  Y por último, el asunto más delicado: el PSOE no parece dispuesto a que Podemos tenga puestos en el Consejo de Ministros para su líder y otros dirigentes, como reclama Iglesias. Sánchez le ha ofrecido otra solución, que es lo que él entiende como Gobierno de cooperación: puestos intermedios en la Administración para Podemos, pero sin ministros. Es una forma de que tenga una entrada en el Ejecutivo socialista pero sin que participe en el Consejo de Ministros, algo que el presidente en funciones ha rechazado hasta ahora.        MÁS INFORMACIÓN                              Sánchez e Iglesias se reúnen pero mantienen “posturas alejadas” sobre la investidura              Pablo Iglesias: “Se equivoca quien vea un pulso, amenazar con elecciones es un error”              Iglesias negociará con Sánchez un “Gobierno de cooperación”                  No parece por tanto, al menos de momento, que la negociación esté frenada en la entrada de Pablo Iglesias en el Gobierno, como se temía en algunos sectores, sino en la entrada en general de Podemos en ese nivel máximo de los ministros. No hay vetos a Iglesias, como él insistía el domingo en la entrevista en EL PAÍS, sino una discusión de fondo sobre el papel de Podemos en la nueva legislatura.  El líder de Unidas Podemos ha dejado muy claro, ante Sánchez y en público, que no piensa aceptar nada que no sea entrar en el Gobierno con ministros propios. Por eso todo indica que la negociación se alargará. Fuentes del entorno de Iglesias creen que la estrategia de los socialistas pasa por dejar todo para el último momento, incluso con la investidura ya convocada —de momento no hay fecha— para intentar que la presión social y mediática suavice su postura. Los socialistas también presionan a su vez a Ciudadanos y al PP para que se abstengan, algo que resolvería sus problemas pero, de momento, parece imposible. Las negociaciones seguirán y habrá muchos contactos en los próximos días. El acuerdo no parece sencillo, pero ninguno de los dos se plantea las elecciones como una alternativa real.          Sin fecha para la investidura del presidente      Solo el presidente decide la fecha de la investidura. De momento no tiene los apoyos, pero puede que se anime a poner una fecha como forma de presión. En el PSOE se maneja la primera o segunda semana de julio. En La Moncloa están entre dos fuegos: no quieren una investidura fallida, que tiene un coste de imagen para todos, también para el presidente, pero tampoco quieren alargarla de forma indefinida. La decisión se acerca.        ",Sánchez ofrece a Pablo Iglesias cargos intermedios pero no ministerios,https://elpais.com/politica/2019/06/18/actualidad/1560883689_575328.html,elpais,elpais.com,6,261
e8a617860291b3c29444951417e7d17a,"          Editorial                Saving Madrid Central                  Starting on July 1, the city of Madrid will put a recently launched pollution-curbing initiative on hold.  The new mayor of the Spanish capital, José Luis Martínez-Almeida of the conservative Popular Party (PP), has announced a temporary freeze on fines for violators of measures aimed at reducing vehicle emissions in the downtown area. While not officially revoking the plan, the freeze effectively cancels it until an unspecified date.            The EU is not demanding Madrid Central from us, it is demanding efficient results in the fight against pollution    Mayor José Luis Martínez-Almeida        The anti-pollution initiative, known as Madrid Central, was introduced in November 2018 by his predecessor Manuela Carmena. It was widely viewed as a legacy-making project for a leftist leader who had brought 24 years of uninterrupted PP governments in the Spanish capital to an end.  But Almeida made a campaign promise to scrap the scheme if he became the city’s new leader. Instead, the PP wants to go back to an earlier traffic-restriction system based on priority for residents established by former mayor Ana Botella.  A year ago, the Madrid Central project was instrumental in sparing Spain legal action by the European Commission before the EU Court of Justice. At that point, the Spanish capital had been exceeding European pollution thresholds for nearly a decade.                            According to EU sources, the proceedings against Spain, triggered by high levels of nitrogen oxides in Madrid and Barcelona, were never fully closed. For now, Brussels has not made any statements and is waiting to see what specific plans the new team in Madrid City Hall comes up with.  The new mayor argues that “the EU is not demanding Madrid Central from us, it is demanding efficient results in the fight against pollution.”            If it eliminated Madrid Central, the city would have to come up with a plan that is equally restrictive with polluting vehicles, or more so, in order to guarantee air quality    Adrián Fernández, Greenpeace        While it is true that the EU has not set out specific policies to adopt, “if [the council] eliminated Madrid Central, the city would have to come up with a plan that is equally restrictive with polluting vehicles, or more so, in order to guarantee air quality,” explains Adrián Fernández, a mobility expert with Greenpeace.  In any case, reversing a plan such as this one would be a first for a major European capital. “It would be the first time,” says Nico Muzi, spokesman for the non-profit group Transporte y Medio Ambiente (Transportation and Environment.) “Besides, the Madrid plan was showing good results.”  A divided council  So far, the municipal council seems divided over the issue. When Carmena’s administration gained approval for Madrid Central – which made 472 hectares of the city center off-limits to traffic except for local residents and public transportation – the right-of-center parties were vocal opponents. The PP and Ciudadanos (Citizens) talked about “chaos,” “inefficiency” and “a disaster.”  The far-right Vox, whose support was essential in getting Almeida into office following the May 26 election, wants to ditch Carmena’s signature project entirely, while Ciudadanos now seems inclined to simply tweak it. “It would not be a good policy to reverse all of Madrid Central,” said Begoña Villacís, who became the deputy mayor at a swearing-in ceremony on Saturday.  Inefficient  The new administration argues that Madrid Central is inefficient. But the data suggest otherwise: in May, 14 of the 24 monitoring stations in the Spanish capital recorded the lowest levels of nitrogen oxides in a decade. And the only sensor located within the restricted traffic area showed a 48% drop.  “There have been global improvements, and there has been no spike in pollution outside the low emissions zone,” says a spokesperson for the green group Ecologistas en Acción, which will take the city of Madrid before the EU if it scraps Madrid Central.  Meanwhile, a citizen group that initially opposed the project now seems far less critical of it.  “We don’t want to eliminate Madrid Central; perhaps it is necessary to rename the project,” said a spokesperson for Plataforma de Afectados por Madrid Central, a group made up of local retailers who had originally predicted “the collapse of 17,000 small and medium enterprises in the Centro district of the capital.”  English version by Susana Urra.  ","Despite risk of EU action, new Madrid mayor puts anti-pollution plan on hold",https://elpais.com/elpais/2019/06/18/inenglish/1560841889_036642.html,elpais,elpais.com,12,633
f4fea19dbf1d5e697162308b34a20936,"  ""Solo venimos al terreno a dar lo que tenemos, entregando el corazón"", dijo el defensa y capitán cubano Yasmani López tras la derrota 7-0 frente a México en la Copa Oro, jugada en Estados Unidos. Esas fueron sus últimas palabras como seleccionado de Cuba. López desertó del combinado nacional, según ha confirmado su entrenador, Raúl Mederos.  ""Con relación al caso de Yasmani, es una decisión de él. Ninguno de los compañeros, somos 30, tenemos que ver con eso"", agregó Mederos durante una rueda de prensa. Yasmani López, central de 31 años, representó a Cuba en los torneos internacionales de fútbol desde 2013. Su último partido fue contra México, en el primer partido de la fase de grupos. López, con el número cuatro en la espalda, disputó los 90 minutos con el brazalete de líder de Cuba. ""Lo importante es que luchamos"" dijo al finalizar el partido contra los mexicanos. ""Me llevo cosas bonitas. Es una experiencia bonita en la Copa Oro para nosotros"", agregó.         MÁS INFORMACIÓN                              México devora a Cuba en el arranque de la Copa Oro                  La selección de Cuba ha afrontado problemas en el arranque de la Copa Oro. El conjunto caribeño arribó a Estados Unidos con escaso tiempo de adaptación: día y medio. Al viaje no pudo acudir su primer capitán y goleador, Yordan Santa Cruz, a quien le negaron su visa. El equipo cubano también tuvo problemas con el reparto de uniformes e incluso, durante el partido contra México, su portero Sandy Sánchez usó un uniforme con un escudo de la Federación cubana viejo y distinto al de sus compañeros.   El historial de deserciones de equipos nacionales cubanos de fútbol y béisbol es largo. En la Copa Oro, por ejemplo, han abandonado el equipo 11 futbolistas en las pasadas seis ediciones (2002, 2005, 2007, 2009, 2011 y 2015). Hace cuatro años, Ariel Martínez escapó del hotel donde estaban hospedados pese haber clasificado a los isleños a cuartos de final. En noviembre pasado, una docena de futbolistas dejó la concentración de la selección cubana durante el Premundial sub 20 de la Concacaf.   Puedes seguir Deportes de EL PAÍS en Facebook, Twitter o suscribirte aquí a la Newsletter.  ",El capitán de Cuba deserta de la selección durante la Copa Oro,https://elpais.com/deportes/2019/06/19/actualidad/1560910291_910985.html,elpais,elpais.com,4,145
