body,title,url"



MÁS INFORMACIÓN














Capítulo 1. Aquí es Tierra Indígena Maró






San Martín y la salvación de los bosques del Amazonas






Ponernos de acuerdo para salvar el planeta








Dani es una joven activista riberina de 21 años. Pero, para convertirse en lo que hoy es, ha realizado un difícil y valeroso ejercicio de búsqueda de identidad que no se entiende sin comprender el contexto en que tuvo lugar.
Muchas de las comunidades que habitan las riberas del río Tapajós, como en tantos otros asentamientos a lo largo de la inmensa cuenca amazónica brasileña, se definen como riberinas, y engloban la diversidad étnica de sus pobladores, fruto del mestizaje entre indígenas, afro-descendientes y blancos de origen europeo, sobre todo ibérico, en múltiples cruces interétnicos a lo largo del tiempo.
Actualmente, definirse como indígena es una cuestión de autoafirmación, pero en muchas comunidades a lo largo de este caudaloso afluente del río Amazonas, la mezcla es tan antigua y dinámica que puede resultar imposible escoger una etnia a la que afiliarse.
Pero cuando el territorio está amenazado por mineras, madereros, el agronegocio y por la apropiación de tierras no tituladas, muchas comunidades han hecho ese ejercicio de autoafirmación y autodemarcación del territorio, demostrando que ocupan esos lugares desde un tiempo suficiente como para reclamar su propiedad al Estado. Conseguir su titulación es la única garantía para evitar ser expulsados de ellas; normalmente, por propietarios de negocios que explotan los abundantes recursos naturales que alberga la región.
Otra vía efectiva para la protección de poblaciones en estos territorios ha sido la declaración de Reservas de Conservación, sean estas permanentes (como las Reservas Biológicas o Parques), o Reservas de Usos Sostenibles, como las reservas extractivistas (Resex) o las Florestas Nacionales (Flona).
En una Flona se ubica la comunidad de Prainha, hoy dividida entre Prahina I y Prainha II. El haber alejado la amenaza exterior a través de la protección relativa que proporciona el vivir dentro de una Floresta Nacional, le permite a la comunidad centrarse en cuestiones internas como la que les ha llevado a constituirse en dos comunidades diferenciadas.








 Vista aérea de las plantaciones de soja en el linde del área reconocido como Floresta Nacional en el bajo Tapajós, donde vive Dani. Pablo Albarenga 













 Detalle de una de las plantaciones de soja junto a la Flona donde vive Dani. Pablo Albarenga 





En Prainha II es donde vive Dani, una valerosa joven que ha realizado un intenso ejercicio de búsqueda de identidad que la llevó al reconocimiento de que es homosexual, lo que escondió durante largo tiempo, reprimida por su familia, la comunidad y también la iglesia.
Para Dani, realizar este ejercicio de reconocimiento dentro de la comunidad resultó prácticamente imposible durante demasiado tiempo. A la importante presencia de iglesias evangelistas de tinte conservador, expandidas con suma eficacia por todo Brasil (en el caso de Prainha II, se trata de la Iglesia Adventista del Séptimo Día), se suman estructuras culturales tradicionales donde la sexualidad está firmemente controlada y explorar cualquier vía alternativa resulta prácticamente inviable. El reparto de roles entre géneros es asimétrico y el control del vínculo sexual y reproductivo a través del matrimonio, muy férreo. En este entorno, la violencia y el abuso sexual es un fenómeno frecuente entre familias y comunidades, donde queda soterrado por el silencio y la ocultación.
En este marco, el viaje de Dani, víctima ella misma de violencia sexual, ha sido muy difícil. Pero a través de su implicación en un colectivo de jóvenes activistas, coordinado por la asociación de jóvenes ambientalistas Engajamundo, ha encontrado el espacio de libertad para expresar libremente su homosexualidad. Reconocerse públicamente como miembro de la comunidad LGTB+ se convirtió en un factor de empoderamiento y en una vía para su compromiso con esta y otras causas importantes para la comunidad.





Si tengo la fuerza para combatir los prejuicios ante la sexualidad, tendré la fuerza necesaria para combatir la invasión de las grandes explotaciones de soja que devoran la floresta




“Mis luchas aquí no son pocas”, cuenta Dani. “Primeramente, por la preservación del área de conservación de la que forma parte la Flona en la que vivimos, que está rodeada de sojeiros [cultivadores industriales de soja]. Por todas partes nos llega la polución de los agrotóxicos y el avance del gran sojeiro, que ya amenaza a varias comunidades vecinas. Poder vivir en este área maravillosa y protegerla, esta es la primera lucha”.
“Pero yo estoy implicada en otra lucha”, continua con determinación. ""Por la sexualidad, un tema que no es abordado en las comunidades, ni en la escuela, ni en las familias. Aquí era imposible asumir por mis propios medios el hecho de ser lesbiana. Por suerte pude hacerlo través de un ejercicio donde exploramos otras formas de lucha y pude traer esta discusión a la escuela donde yo estudié a los 16 y 17 años. Fue el periodo en el que sufrí más. Sufrí en las comunidades, sufrí en la escuela, sufrí en la familia”.
“Hasta hace poco tiempo, me sentía una persona incapaz, me sentía una basura, la verdad”, dice Dani con la emoción que trae el recuerdo del sufrimiento. “Yo sentía que no era nadie, parecía un saco abandonado. No era nadie, pero nadie, la verdad”.








 Dani y algunos amigos posan para un retrato en el margen del río Tapajós tras finalizar una actividad reivindicativa de los derechos LGBT+. Pablo Albarenga 





Poder pasar de la represión, la frustración, la depresión y los intentos de suicidio al orgullo de reconocerse fue un paso determinante en la vida de Dani, hoy convertida en militante de la causa LGBT+. “El hecho de que pueda golpearme en el pecho y decirme que yo soy una inspiración para otros, es un orgullo. El que un joven dijese el otro día: 'Yo voy hacer lo que hizo Dani'. Eso fue un privilegio muy grande para mí. Una felicidad”.
Para esta joven menuda, pero desafiante, el vínculo entre la lucha por la sexualidad y la causa ambientalista de defensa del territorio está muy claro. Ambas luchas son muy duras en estas comunidades del bajo Tapajós: “Si tengo la fuerza para combatir los prejuicios ante la sexualidad, tendré la fuerza necesaria para combatir la invasión de las grandes explotaciones de soja que devoran la floresta, que retan a las comunidades y que rodean nuestra Flona, amenazando con asfixiarla”.
Para Dani, ambas causas están íntimamente ligadas entre sí. “Porque yo soy ahora una resistente”, dice. “Si resistí la represión de mi sexualidad, resistiré la invasión de mi territorio por parte de los sojeiros. Esto lo tengo claro”.
Este vínculo entre existir y resistir es común entre los jóvenes activistas, ya sean riberinos, indígenas o afrodescendientes, a lo largo del río y en el interior de la selva.








 Dani lava su ropa en la comunidad de Prainha II, donde vive, dentro de la reserva Floresta Nacional de Tapajós, Pará, Brasil. Pablo Albarenga 





Dani se muestra muy lúcida en la descripción del proceso de concienciación de estas comunidades amazónicas, alejadas de los núcleos urbanos y relativamente aisladas, autónomas en su funcionamiento. Tanto frente a las amenazas de invasión del territorio y contra el medio ambiente, como ante sus sistemas sociales cerrados, que están dominados por estructuras tradicionales que vienen de lejos.
Pero entre todas las amenazas descritas y percibidas, Dani es consciente de que la mayor de todas ellas proviene de la coyuntura política derivada de la elección, en noviembre de 2018, del nuevo presidente del país, Jair Bolsonaro: “Hoy en día, lo que da miedo es el momento político que está viviendo Brasil. Ahora mismo, yo tengo miedo de salir de casa por culpa de algunas personas, por culpa del prejuicio dominante. Yo puedo salir de casa un día y puedo no volver. Yo puedo salir de casa andando y regresar en una silla de ruedas. Este es mi mayor miedo”.




Bolsonaro ha manifestado claramente su intención de frenar a los activistas porque son ellos los que levantan la conciencia sobre los enormes daños que la economía depredadora y la deforestación masiva vienen causando en la Amazonia



Bolsonaro ha manifestado claramente su intención de frenar a los activistas porque son ellos los que levantan la conciencia sobre los enormes daños que la economía depredadora y la deforestación masiva vienen causando en áreas enormes de la Amazonia; y que, ahora que los hacenderos, los ruralistas y las grandes empresas sienten que cuentan con carta blanca al amparo del nuevo gobierno, pueden causar el mayor de los desastres.
Bolsonaro tiene también claro que acabar con los activistas que defienden sus derechos, ya sea como pueblos originarios, cuya arma es su autoafirmación indígena, o a través de la defensa de su afrodescendencia, o de la causa LGTB+, es acabar con el germen de toda resistencia a un proyecto destructor. Sucesos recientes de agresión a personas LGTB+ en las calles de ciudades brasileñas, como ha sido el caso de Luana Trans en Santarém, están generando una atmósfera de violencia contra estos colectivos muy peligrosa, haciendo que el miedo gane espacio a la vez que las libertades se están viendo reducidas aceleradamente.
Antes de participar en acciones con los demás activistas de la región, Dani, en la soledad de su desamparo, había entrado en una dinámica de autodestrucción muy peligrosa. Verse reconocida es lo que ahora le da una fuerza indomable que proyecta, no solo en la lucha contra la homofobia, sino también contra el racismo y contra la violencia sexual, que vienen a sumarse a la causa medioambiental frente a las amenazas del agronegocio.
La obsesión de Bolsonaro por combatir a estos activistas les da precisamente toda la razón para persistir en su lucha, más que nunca: sin su valerosa acción en el territorio, la homofobia, el racismo, la violencia de género, la violencia contra las minorías y la economía depredadora sin escrúpulos no tendrían límite alguno. Dani está aquí para recordárnoslo.
Este artículo pertenece a la serie Rainforest Defenders, un proyecto de openDemocracy / democraciaAbierta en colaboración con Engajamundo Brasil, con el apoyo del Rainforest Journalism Fund del Pulitzer Center.
Puedes seguir a PLANETA FUTURO en Twitter y Facebook e Instagram, y suscribirte aquí a nuestra newsletter.
",La joven amazónica que lucha por los bosques y los derechos LGTB,https://elpais.com/elpais/2019/06/06/planeta_futuro/1559827900_555093.html
"



MÁS INFORMACIÓN














México reconoce que “probablemente” negará la entrada a los migrantes que se dirijan hacia EE UU






López Obrador cierra filas con los empresarios tras la crisis de los aranceles






México admite que deberá negociar la condición de tercer país seguro si no frena el flujo migratorio








La crisis migratoria que atraviesa México ha roto las costuras de la política de austeridad que ha guiado los primeros meses del Gobierno de Andrés Manuel López Obrador. El aumento de la presión por parte de Estados Unidos para que el país latinoamericano frene el flujo de migrantes ha obligado a un cambio de rumbo. Tras varios meses de recortes, el subsecretario mexicano para América Latina y el Caribe, Maximiliano Reyes, ha reconocido este lunes que no tienen una estimación del costo total que implicará contener la crisis y ha asegurado que no han solicitado ampliar el presupuesto para cumplir con Washington. Sin embargo, en el primer cuatrimestre de 2019, el Instituto Nacional de Migración (INM) gastó casi 600 millones de pesos, más de 30 millones de dólares, casi un 50% más de lo aprobado para ese mismo periodo en los presupuestos. Un incremento que, según los expertos en migración y presupuesto consultados, se acentuará tras el reciente acuerdo con la Administración Trump.
Tras ocho días de incertidumbre a causa de la amenaza arancelaria, México se comprometió hace dos semanas a tomar medidas “sin precedentes” para frenar la inmigración. Sin embargo, el rastro del dinero indica que el grifo de recursos ya había sido abierto desde hacía unos meses, según muestran las cifras del Informe de avance de gasto. Además del presupuesto correspondiente a sueldos y retribuciones, unos 370 millones de pesos, el INM, encargado de aplicar la política del país en este ámbito, gastó 230 millones más, casi 12 millones de dólares, en los primeros cuatro meses. El organismo público, cuyo titular, Tonatiuh Guillén, dimitió el viernes, no ha respondido a las peticiones de aclaración de este periódico.
De este gasto extra, un 36% corresponde a asignaciones de vigilancia, un 23% a alimentos y limpieza, y casi un 5% a “traslados”, una etiqueta que incluye las deportaciones. Todo esto en el marco de una intensificación de las detenciones, la triplicación del número de personas deportadas de diciembre a abril y el colapso de los centros de internamiento de migrantes. Preguntado sobre este último punto, el subsecretario Maximiliano Reyes ha revelado este lunes que el Gobierno contempla ""modernizar y ampliar"" albergues de acogida, entre ellos la Estación Migratoria Siglo XXI en la ciudad de Tapachula, fronteriza con Guatemala. Esto se hará con contribuciones del Fondo Yucatán, un instrumento de cooperación que México creó en 2011 para financiar proyectos de infraestructura en Centroamérica y el Caribe. 






// <![CDATA[
!function(){""use strict"";window.addEventListener(""message"",function(a){if(void 0!==a.data[""datawrapper-height""])for(var e in a.data[""datawrapper-height""]){var t=document.getElementById(""datawrapper-chart-""+e)||document.querySelector(""iframe[src*='""+e+""']"");t&&(t.style.height=a.data[""datawrapper-height""][e]+""px"")}})}();
// ]]>




El dinero destinado a alimentos para los migrantes es una muestra de lo sucedido con el presupuesto. En los primeros tres meses de 2019, el INM adjudicó contratos de manera directa para abastecer de comida a los centros migratorios por un promedio de nueve millones al mes. Pero ya a finales de marzo, en pleno desarrollo de la crisis, el Instituto abrió dos licitaciones públicas para cubrir ese servicio el resto del año por un promedio de 24 millones al mes, cerca del triple mensual.
El desglose de los datos muestra que el mayor salto de gasto se ha producido entre marzo y abril. Los expertos consultados explican que ese aumento, del 78%, puede darse por dos factores. El primero es el endurecimiento de la política migratoria del Gobierno de López Obrador. El segundo es la lentitud en la ejecución del presupuesto y el retraso en los pagos de los contratos, típicos del cambio de Administración.
En cualquier caso, es probable que el gasto anual supere con creces el monto asignado a finales de 2018 por el Congreso. Pese a que la ley actual permite a la Secretaría de Hacienda un margen de maniobra sobre lo aprobado por el poder legislativo, los contratos firmados en abril para el resto del año implican que en diciembre de 2019 el Gobierno habrá gastado al menos unos 875 de millones por encima de lo presupuestado. Es una estimación a la baja, ya que no tiene en cuenta el aumento de presupuesto al que el Gobierno ha hecho referencia para responder a las exigencias planteadas por EE UU. “Si bien en abril se habían incrementado los recursos, el acuerdo tiene una implicación mucho mayor que rebasa el presupuesto total que se tiene para este año”, explica el director del Instituto para el Desarrollo Industrial y el Crecimiento Económico, José Luis de la Cruz.






// <![CDATA[
!function(){""use strict"";window.addEventListener(""message"",function(a){if(void 0!==a.data[""datawrapper-height""])for(var e in a.data[""datawrapper-height""]){var t=document.getElementById(""datawrapper-chart-""+e)||document.querySelector(""iframe[src*='""+e+""']"");t&&(t.style.height=a.data[""datawrapper-height""][e]+""px"")}})}();
// ]]>




Esta tendencia se da en el marco de una política de recortes y despidos en la Administración federal, de los que el organismo fue uno de los principales afectados a principios de año. Pese al crecimiento continuo de los flujos migratorios, el presupuesto del Instituto para 2019 incluyó un hachazo de alrededor del 23% respecto al 2018. Además, se eliminaron 720 puestos de trabajo en una purga lanzada por la nueva dirección para acabar con las prácticas de una institución asociada con la corrupción. El secretario de Relaciones Exteriores, Marcelo Ebrard, ha dicho este lunes, sin entrar en detalles, que la plantilla del Instituto INM fue reforzada durante el fin de semana. Para la Comar, el organismo encargado de tramitar la solicitudes de asilo, se previeron 21 millones, seis menos que el anterior y el presupuesto más bajo desde 2011. 
Los recortes han agarrado al Gobierno a contrapié. Las crecientes presiones de EE UU han obligado a un giro en la política respecto al inicio del año, cuando el Ejecutivo abrió las puertas de la frontera sur a miles de migrantes. Los recién llegados recibieron entonces visas humanitarias que les permitían transitar y encontrar trabajo en todo el territorio nacional. Esta situación no tardó en cambiar cuando Trump subió la presión. “En el periodo en que México empieza a tener mayor rispidez con EE UU es cuando el dinero se dispara”, señala el experto Jorge Andrade, del Instituto para la Seguridad y la Democracia.






// <![CDATA[
!function(){""use strict"";window.addEventListener(""message"",function(a){if(void 0!==a.data[""datawrapper-height""])for(var e in a.data[""datawrapper-height""]){var t=document.getElementById(""datawrapper-chart-""+e)||document.querySelector(""iframe[src*='""+e+""']"");t&&(t.style.height=a.data[""datawrapper-height""][e]+""px"")}})}();
// ]]>




Las cifras de gasto del INM no capturan plenamente la dimensión de la inversión en migración. A los recursos del Instituto se tiene que añadir el de otras Secretarías involucradas en la respuesta del Gobierno a este desafío, que a partir de ahora coordinará el canciller Marcelo Ebrard. El jefe de la diplomacia mexicana ha confirmado este lunes que está previsto que esta semana se complete el despliegue en la frontera sur de los 6.000 miembros de la Guardia Nacional, dependientes de la Secretaría de la Función Pública. Además, el Gobierno está recabando apoyos internacionales para poner en marcha el Plan de Desarrollo Integral para Centroamérica. El INM es una pieza más del rompecabezas y una cada vez menos relevante, según los expertos. “Parece haber quedado fuera de la jugada; la respuesta va a ser operada por Cancillería”, sostiene Andrade.
La afirmación del subsecretario Maximiliano Reyes sobre la no ampliación del presupuesto choca con las declaraciones de algunos líderes del partido del presidente López Obrador, quienes la semana pasada dijeron que esperaban “un aumento importante”. La pregunta es, según el director del Centro de Investigación Económica y Presupuestaria (CIEP), Héctor Villarreal, ¿a quién se le va a cargar el paquete? “No hay un solo programa; van a terminar agarrando recursos de programas que tienen otros fines”, dice el experto. Lo que parece claro, según José Luis de la Cruz, es que ante este nuevo panorama el Ejecutivo deberá trasladar el recorte a otras áreas para poder cumplir con su promesa de austeridad: “Va a tener que hacer ajustes en otros gastos públicos”.
",La crisis migratoria en México golpea la política de austeridad de López Obrador,https://elpais.com/internacional/2019/06/17/mexico/1560790707_123427.html
